{
  "$schema": "../case.schema.json",
  "id": "ordinary-repeat-payment-on-the-usual-account",
  "title": "The boring case: same supplier, same account, same amount as every other week",
  "kind": "negative",
  "notes": "Most of a real payment run looks like this, and a sentinel is judged on it before it is judged on anything else. Every one of the six controls has to stay quiet, and this case is here so that a change which makes one of them chatty fails loudly.",
  "input": {
    "instruction": {
      "id": "INS-HOLDOUT-123",
      "supplierRfc": "SYN252727S27",
      "cfdiUuids": ["00000000-0094-4d00-8a00-000000000094"],
      "clabe": "072180100000000007",
      "amount": 35380,
      "source": "portal",
      "receivedAt": "2026-09-10T15:30:00.000Z",
      "synthetic": true
    },
    "supplier": {
      "rfc": "SYN252727S27",
      "legalName": "Ferreteria Industrial Escobedo SA de CV",
      "firstInvoiceAt": "2022-02-03T15:30:00.000Z",
      "knownAccounts": [
        {
          "clabe": "072180100000000007",
          "establishedBy": "payment_complement",
          "establishedAt": "2022-02-17T15:30:00.000Z",
          "timesPaid": 132
        }
      ],
      "synthetic": true
    },
    "cfdis": [
      {
        "uuid": "00000000-0085-4d00-8a00-000000000085",
        "serie": "A",
        "folio": "600",
        "issuedAt": "2026-05-21T15:30:00.000Z",
        "issuerRfc": "SYN252727S27",
        "issuerName": "Ferreteria Industrial Escobedo SA de CV",
        "receiverRfc": "SYN090615C01",
        "subtotal": 27800,
        "iva": 4448,
        "total": 32248,
        "paymentMethod": "PPD",
        "paymentForm": "03",
        "synthetic": true
      },
      {
        "uuid": "00000000-0086-4d00-8a00-000000000086",
        "serie": "A",
        "folio": "601",
        "issuedAt": "2026-05-28T15:30:00.000Z",
        "issuerRfc": "SYN252727S27",
        "issuerName": "Ferreteria Industrial Escobedo SA de CV",
        "receiverRfc": "SYN090615C01",
        "subtotal": 28900,
        "iva": 4624,
        "total": 33524,
        "paymentMethod": "PPD",
        "paymentForm": "03",
        "synthetic": true
      },
      {
        "uuid": "00000000-0087-4d00-8a00-000000000087",
        "serie": "A",
        "folio": "602",
        "issuedAt": "2026-06-04T15:30:00.000Z",
        "issuerRfc": "SYN252727S27",
        "issuerName": "Ferreteria Industrial Escobedo SA de CV",
        "receiverRfc": "SYN090615C01",
        "subtotal": 30000,
        "iva": 4800,
        "total": 34800,
        "paymentMethod": "PPD",
        "paymentForm": "03",
        "synthetic": true
      },
      {
        "uuid": "00000000-0088-4d00-8a00-000000000088",
        "serie": "A",
        "folio": "603",
        "issuedAt": "2026-06-11T15:30:00.000Z",
        "issuerRfc": "SYN252727S27",
        "issuerName": "Ferreteria Industrial Escobedo SA de CV",
        "receiverRfc": "SYN090615C01",
        "subtotal": 31100,
        "iva": 4976,
        "total": 36076,
        "paymentMethod": "PPD",
        "paymentForm": "03",
        "synthetic": true
      },
      {
        "uuid": "00000000-0089-4d00-8a00-000000000089",
        "serie": "A",
        "folio": "604",
        "issuedAt": "2026-06-18T15:30:00.000Z",
        "issuerRfc": "SYN252727S27",
        "issuerName": "Ferreteria Industrial Escobedo SA de CV",
        "receiverRfc": "SYN090615C01",
        "subtotal": 32200,
        "iva": 5152,
        "total": 37352,
        "paymentMethod": "PPD",
        "paymentForm": "03",
        "synthetic": true
      },
      {
        "uuid": "00000000-008a-4d00-8a00-00000000008a",
        "serie": "A",
        "folio": "605",
        "issuedAt": "2026-06-25T15:30:00.000Z",
        "issuerRfc": "SYN252727S27",
        "issuerName": "Ferreteria Industrial Escobedo SA de CV",
        "receiverRfc": "SYN090615C01",
        "subtotal": 27800,
        "iva": 4448,
        "total": 32248,
        "paymentMethod": "PPD",
        "paymentForm": "03",
        "synthetic": true
      },
      {
        "uuid": "00000000-008b-4d00-8a00-00000000008b",
        "serie": "A",
        "folio": "606",
        "issuedAt": "2026-07-02T15:30:00.000Z",
        "issuerRfc": "SYN252727S27",
        "issuerName": "Ferreteria Industrial Escobedo SA de CV",
        "receiverRfc": "SYN090615C01",
        "subtotal": 28900,
        "iva": 4624,
        "total": 33524,
        "paymentMethod": "PPD",
        "paymentForm": "03",
        "synthetic": true
      },
      {
        "uuid": "00000000-008c-4d00-8a00-00000000008c",
        "serie": "A",
        "folio": "607",
        "issuedAt": "2026-07-09T15:30:00.000Z",
        "issuerRfc": "SYN252727S27",
        "issuerName": "Ferreteria Industrial Escobedo SA de CV",
        "receiverRfc": "SYN090615C01",
        "subtotal": 30000,
        "iva": 4800,
        "total": 34800,
        "paymentMethod": "PPD",
        "paymentForm": "03",
        "synthetic": true
      },
      {
        "uuid": "00000000-008d-4d00-8a00-00000000008d",
        "serie": "A",
        "folio": "608",
        "issuedAt": "2026-07-16T15:30:00.000Z",
        "issuerRfc": "SYN252727S27",
        "issuerName": "Ferreteria Industrial Escobedo SA de CV",
        "receiverRfc": "SYN090615C01",
        "subtotal": 31100,
        "iva": 4976,
        "total": 36076,
        "paymentMethod": "PPD",
        "paymentForm": "03",
        "synthetic": true
      },
      {
        "uuid": "00000000-008e-4d00-8a00-00000000008e",
        "serie": "A",
        "folio": "609",
        "issuedAt": "2026-07-23T15:30:00.000Z",
        "issuerRfc": "SYN252727S27",
        "issuerName": "Ferreteria Industrial Escobedo SA de CV",
        "receiverRfc": "SYN090615C01",
        "subtotal": 32200,
        "iva": 5152,
        "total": 37352,
        "paymentMethod": "PPD",
        "paymentForm": "03",
        "synthetic": true
      },
      {
        "uuid": "00000000-008f-4d00-8a00-00000000008f",
        "serie": "A",
        "folio": "610",
        "issuedAt": "2026-07-30T15:30:00.000Z",
        "issuerRfc": "SYN252727S27",
        "issuerName": "Ferreteria Industrial Escobedo SA de CV",
        "receiverRfc": "SYN090615C01",
        "subtotal": 27800,
        "iva": 4448,
        "total": 32248,
        "paymentMethod": "PPD",
        "paymentForm": "03",
        "synthetic": true
      },
      {
        "uuid": "00000000-0090-4d00-8a00-000000000090",
        "serie": "A",
        "folio": "611",
        "issuedAt": "2026-08-06T15:30:00.000Z",
        "issuerRfc": "SYN252727S27",
        "issuerName": "Ferreteria Industrial Escobedo SA de CV",
        "receiverRfc": "SYN090615C01",
        "subtotal": 28900,
        "iva": 4624,
        "total": 33524,
        "paymentMethod": "PPD",
        "paymentForm": "03",
        "synthetic": true
      },
      {
        "uuid": "00000000-0091-4d00-8a00-000000000091",
        "serie": "A",
        "folio": "612",
        "issuedAt": "2026-08-13T15:30:00.000Z",
        "issuerRfc": "SYN252727S27",
        "issuerName": "Ferreteria Industrial Escobedo SA de CV",
        "receiverRfc": "SYN090615C01",
        "subtotal": 30000,
        "iva": 4800,
        "total": 34800,
        "paymentMethod": "PPD",
        "paymentForm": "03",
        "synthetic": true
      },
      {
        "uuid": "00000000-0092-4d00-8a00-000000000092",
        "serie": "A",
        "folio": "613",
        "issuedAt": "2026-08-20T15:30:00.000Z",
        "issuerRfc": "SYN252727S27",
        "issuerName": "Ferreteria Industrial Escobedo SA de CV",
        "receiverRfc": "SYN090615C01",
        "subtotal": 31100,
        "iva": 4976,
        "total": 36076,
        "paymentMethod": "PPD",
        "paymentForm": "03",
        "synthetic": true
      },
      {
        "uuid": "00000000-0093-4d00-8a00-000000000093",
        "serie": "A",
        "folio": "614",
        "issuedAt": "2026-08-27T15:30:00.000Z",
        "issuerRfc": "SYN252727S27",
        "issuerName": "Ferreteria Industrial Escobedo SA de CV",
        "receiverRfc": "SYN090615C01",
        "subtotal": 32200,
        "iva": 5152,
        "total": 37352,
        "paymentMethod": "PPD",
        "paymentForm": "03",
        "synthetic": true
      },
      {
        "uuid": "00000000-0094-4d00-8a00-000000000094",
        "serie": "A",
        "folio": "616",
        "issuedAt": "2026-09-08T15:30:00.000Z",
        "issuerRfc": "SYN252727S27",
        "issuerName": "Ferreteria Industrial Escobedo SA de CV",
        "receiverRfc": "SYN090615C01",
        "subtotal": 30500,
        "iva": 4880,
        "total": 35380,
        "paymentMethod": "PPD",
        "paymentForm": "03",
        "synthetic": true
      }
    ],
    "satEntries": []
  },
  "expectedFindings": [],
  "expectedAction": "release"
}
